{
  "schema_version": "0.3.0",
  "document_type": "point_dictionary",
  "generated_at": "2026-08-06T18:51:57Z",
  "source_document": "Homestead_Digital_Twin_Software_Design_Document_v0.2.md",
  "point_classes": {
    "AI": {
      "name": "Analog input",
      "read_write": "read",
      "description": "Continuously measured numeric value."
    },
    "DI": {
      "name": "Digital input",
      "read_write": "read",
      "description": "Boolean or enumerated observed state."
    },
    "AO": {
      "name": "Analog output",
      "read_write": "write",
      "description": "Numeric command or setpoint."
    },
    "DO": {
      "name": "Digital output",
      "read_write": "write",
      "description": "Boolean or enumerated command."
    },
    "CALC": {
      "name": "Calculated",
      "read_write": "read",
      "description": "Derived value generated by software or controller."
    },
    "CFG": {
      "name": "Configuration",
      "read_write": "controlled_write",
      "description": "Persistent configuration value."
    },
    "EVENT": {
      "name": "Event",
      "read_write": "append_only",
      "description": "Timestamped discrete occurrence."
    },
    "ALARM": {
      "name": "Alarm",
      "read_write": "state_machine",
      "description": "Abnormal condition with lifecycle."
    },
    "COUNTER": {
      "name": "Counter",
      "read_write": "read",
      "description": "Monotonic runtime, cycle, volume or energy total."
    },
    "TEXT": {
      "name": "Text/status",
      "read_write": "read",
      "description": "Diagnostic message, firmware, model or status detail."
    }
  },
  "quality_codes": {
    "good": "Valid and within expected acquisition timing.",
    "uncertain": "Usable with caution; drift, estimated value, or stale-but-tolerable.",
    "bad": "Invalid, failed sensor, failed checksum, or out-of-physical-range.",
    "stale": "No update within the defined point timeout.",
    "substituted": "Replaced by fallback or manually entered value.",
    "calculated": "Derived from other values.",
    "maintenance": "Device intentionally unavailable or under test."
  },
  "canonical_units": {
    "W": "watt",
    "kW": "kilowatt",
    "Wh": "watt-hour",
    "kWh": "kilowatt-hour",
    "V": "volt",
    "A": "ampere",
    "Hz": "hertz",
    "ratio": "dimensionless ratio",
    "°C": "degrees Celsius",
    "%RH": "percent relative humidity",
    "%": "percent",
    "kPa": "kilopascal",
    "L/min": "litres per minute",
    "m³/h": "cubic metres per hour",
    "L": "litre",
    "m³": "cubic metre",
    "ppm": "parts per million",
    "volume %": "volume percent",
    "% VWC": "percent volumetric water content",
    "mm": "millimetre",
    "m/s": "metres per second",
    "W/m²": "watts per square metre",
    "pH": "pH unit",
    "mS/cm": "millisiemens per centimetre",
    "h": "hour",
    "s": "second",
    "min": "minute",
    "ms": "millisecond",
    "d": "day",
    "kvar": "kilovolt-ampere reactive",
    "mV": "millivolt",
    "NTU": "nephelometric turbidity unit",
    "µmol/m²/s": "micromoles per square metre per second",
    "dBm": "decibels referenced to one milliwatt",
    "kg": "kilogram",
    "count": "count",
    "messages/s": "messages per second",
    "m²": "square metre",
    "m": "metre",
    "VA": "volt-ampere",
    "rpm": "revolutions per minute"
  },
  "point_name_pattern": "^[a-z][a-z0-9_]*$",
  "point_path_format": "<asset_id>/<point_name>",
  "points": {
    "availability_state": {
      "default_class": "DI",
      "allowed_classes": [
        "DI"
      ],
      "data_type": "enum",
      "unit": null,
      "description": "Communications and service availability state.",
      "control_capable": false,
      "automatic_control_default": false,
      "applicable_asset_classes": [],
      "source_section": "26.5",
      "dictionary_status": "baseline_v0_2",
      "enum_values": [
        "online",
        "offline",
        "degraded",
        "unknown"
      ]
    },
    "state_operating": {
      "default_class": "DI",
      "allowed_classes": [
        "DI"
      ],
      "data_type": "enum",
      "unit": null,
      "description": "Equipment-specific actual operating state.",
      "control_capable": false,
      "automatic_control_default": false,
      "applicable_asset_classes": [],
      "source_section": "26.5",
      "dictionary_status": "baseline_v0_2"
    },
    "mode_actual": {
      "default_class": "DI",
      "allowed_classes": [
        "DI"
      ],
      "data_type": "enum",
      "unit": null,
      "description": "Actual control mode.",
      "control_capable": false,
      "automatic_control_default": false,
      "applicable_asset_classes": [],
      "source_section": "26.5",
      "dictionary_status": "baseline_v0_2",
      "enum_values": [
        "off",
        "manual",
        "automatic",
        "scheduled",
        "maintenance",
        "degraded",
        "emergency"
      ]
    },
    "mode_requested": {
      "default_class": "DO",
      "allowed_classes": [
        "DO"
      ],
      "data_type": "enum",
      "unit": null,
      "description": "Requested supervisory mode.",
      "control_capable": true,
      "automatic_control_default": true,
      "applicable_asset_classes": [],
      "source_section": "26.5",
      "dictionary_status": "baseline_v0_2",
      "enum_values": [
        "off",
        "manual",
        "automatic",
        "scheduled",
        "maintenance",
        "degraded",
        "emergency"
      ]
    },
    "control_owner": {
      "default_class": "DI",
      "allowed_classes": [
        "DI"
      ],
      "data_type": "enum",
      "unit": null,
      "description": "Current authoritative control owner.",
      "control_capable": false,
      "automatic_control_default": false,
      "applicable_asset_classes": [],
      "source_section": "26.5",
      "dictionary_status": "baseline_v0_2",
      "enum_values": [
        "local",
        "supervisory",
        "manual",
        "vendor",
        "safety"
      ]
    },
    "manual_override_active": {
      "default_class": "DI",
      "allowed_classes": [
        "DI"
      ],
      "data_type": "boolean",
      "unit": null,
      "description": "Local manual override is active.",
      "control_capable": false,
      "automatic_control_default": false,
      "applicable_asset_classes": [],
      "source_section": "26.5",
      "dictionary_status": "baseline_v0_2"
    },
    "interlock_permissive": {
      "default_class": "DI",
      "allowed_classes": [
        "DI"
      ],
      "data_type": "boolean",
      "unit": null,
      "description": "All required start/run permissives are satisfied.",
      "control_capable": false,
      "automatic_control_default": false,
      "applicable_asset_classes": [],
      "source_section": "26.5",
      "dictionary_status": "baseline_v0_2"
    },
    "interlock_block_reason": {
      "default_class": "TEXT",
      "allowed_classes": [
        "TEXT"
      ],
      "data_type": "string",
      "unit": null,
      "description": "Primary reason operation is blocked.",
      "control_capable": false,
      "automatic_control_default": false,
      "applicable_asset_classes": [],
      "source_section": "26.5",
      "dictionary_status": "baseline_v0_2"
    },
    "fault_active": {
      "default_class": "DI",
      "allowed_classes": [
        "DI"
      ],
      "data_type": "boolean",
      "unit": null,
      "description": "At least one active equipment fault.",
      "control_capable": false,
      "automatic_control_default": false,
      "applicable_asset_classes": [],
      "source_section": "26.5",
      "dictionary_status": "baseline_v0_2"
    },
    "fault_code": {
      "default_class": "TEXT",
      "allowed_classes": [
        "TEXT"
      ],
      "data_type": "string",
      "unit": null,
      "description": "Manufacturer or normalized fault code.",
      "control_capable": false,
      "automatic_control_default": false,
      "applicable_asset_classes": [],
      "source_section": "26.5",
      "dictionary_status": "baseline_v0_2"
    },
    "alarm_summary": {
      "default_class": "DI",
      "allowed_classes": [
        "DI"
      ],
      "data_type": "enum",
      "unit": null,
      "description": "Highest active alarm severity.",
      "control_capable": false,
      "automatic_control_default": false,
      "applicable_asset_classes": [],
      "source_section": "26.5",
      "dictionary_status": "baseline_v0_2",
      "enum_values": [
        "none",
        "advisory",
        "warning",
        "alarm",
        "critical"
      ]
    },
    "command_last_id": {
      "default_class": "TEXT",
      "allowed_classes": [
        "TEXT"
      ],
      "data_type": "string",
      "unit": null,
      "description": "Last command acknowledged.",
      "control_capable": false,
      "automatic_control_default": false,
      "applicable_asset_classes": [],
      "source_section": "26.5",
      "dictionary_status": "baseline_v0_2"
    },
    "command_last_result": {
      "default_class": "DI",
      "allowed_classes": [
        "DI"
      ],
      "data_type": "enum",
      "unit": null,
      "description": "Result of the last command.",
      "control_capable": false,
      "automatic_control_default": false,
      "applicable_asset_classes": [],
      "source_section": "26.5",
      "dictionary_status": "baseline_v0_2",
      "enum_values": [
        "accepted",
        "rejected",
        "completed",
        "failed",
        "expired"
      ]
    },
    "heartbeat_age_s": {
      "default_class": "CALC",
      "allowed_classes": [
        "CALC"
      ],
      "data_type": "float",
      "unit": "s",
      "description": "Age of last valid message.",
      "control_capable": false,
      "automatic_control_default": false,
      "applicable_asset_classes": [],
      "source_section": "26.5",
      "dictionary_status": "baseline_v0_2",
      "physical_range": {